message,label
Perform white space safe deletion of files named core under /tmp,query
display all the regular files in the folder $(FOLDER) which are modified in the last $(RETENTION)*24 hours and excluding hidden files,query
Search directory tree $DIR for *.txt files,query
Print the list of .txt files under and below the current directory,query
find all the files ending with undo in the current folder and calculate the total size of these files,query
Make directories and parents for each file path in somefile.txt excluding the file name,query
Change string searc to replace in all files in directory hierarchy,editor
Extract rpm libstdc++-4.9.2-1.fc21.x86_64.rpm,editor
find regular files named core under /tmp and delete them,editor
find all files that aren't owned by user www-data,query
Unset the DISPLAY variable,query
find the largest original .gz file in the current directory tree,query
Compress all .txt files in the current directory tree with gzip,editor
Execute ls -l every 2 seconds,query
change owner and group of the file /path/to/yourapp to root,editor
Recursively copies src to dest preserving overwriting the existing files.,query
Numerically sort file files by the second - separated value of each line ordered from least value to highest value,query
remove all Foo* files under current dir,editor
List environment variables whose name matches .*X.*,query
"Recursively copy local file/directory /copy/from/path to remote location /copy/to/path on host server, connecting as ssh user user and using identity key file /path/to/your/.pemkey instead of the default in ~/.ssh/",editor
create a hard link as directory named new_hard_link to the directory existing_dir as root,editor
Search for ifconfig in the output of history and print 5 lines that precede and follow,query
"Extract the second-to-last slash-separated path component, ie. 90_2a5 in this case.",editor
Print pathnames of all files in the current directory and below skipping files under SCCS directories,query
Synchronize /path/to/dir_a with files in /path/to/dir_b/ if the files are newer,query
find all files whose names begin with Makefile in the /usr/ports directory tree and count how many of them contain QMAKESPEC,query
find files/directories under /users/tom that matches both the pattern *.pl and  *.pm,query
Convert directory of files from dos to unix,query
find in the entire file system for the file mysql,query
"Recursively copy directories A and D to directory /path/to/target/directory on host anotherhost, connecting as ssh user matching current user on local host, via default TCP port for ssh (22).",editor
Use top to monitor the newest instance of ProgramName.,query
Search for files whose size is between 100 kilobytes and 500 kilobytes,query
Search the current directory tree for files containing needle in their names,query
find all the files in the file system that start with win and searched only in the mounted file systems,query
list all regular files which path is not dir1 or dir2,query
search for all text files in current folder and delete them,editor
search for specified string in all the php files in the current folder,query
find all regular files exclude .o and exclude *.swp and output line number of soc_attach if it has,query
find all files/directories named foo.rb under current directory tree,query
Print a welcome message with the current user's user name,query
Recursively change the owner and group of /workspace and 775 to your_user_name,editor
Create a zip file ($zipFile) of all *.log files under $sourcePath,editor
find all files in the file system whose size is bigger than 3GB,query
"Make directories Labs/lab4a/folder1, Labs/lab4a/myfolder, and Labs/lab4a/foofolder",query
display all files in the current folder which start with met,query
List every directory under current directory with their child executable files,query
find all *$VERSION* files/directories under current directory where $VERSION is a variable,query
list all system calls during process of symbolic link creation process on  /tmp/output.txt file,query
List all directories and subdirectories,query
"Search all regular files from the current directory tree for lines containing California and surfboard, and save the output as SurfsUp.txt",query
List all regular files from the current directory tree that were modified less than 60 days ago,query
find all gif files in the file system,query
Print unique list of who is logged in and the time of login formatted in columns,query
Login to remote system app1 through an ssh gateway system called gw,query
Print the most recently modified file,query
find all the normal/regular files in the folder main-directory,query
Kill screen session 23536,query
Serach in current directory downwards all files which  have not been modified since last 7 days,query
find all *.gz files in the current directory and decompress them using gunzip,editor
find all files with the extension jpg regardless of case,query
Prints week day of a 31 day in a current month.,query
find all files not ending in .html,query
Print lines in file filename that do not match the regex pattern,query
find all the directories with the name uploads in current folder,query
search for files in current folder using name patterns,query
"find all files modified less than 5 minutes ago, and page interactively through the output.",query
"delete recursively, without prompting, any files or directories under the current directory that case insensitively match the filename .svn",editor
Sort content of files file1 and file2 by second of dot-separated fields.,query
List all empty files under the current directory,query
Print the sorted unique column of usernames of users who are currently logged in without the header,query
Search the regular files of the current directory tree for string whatever,query
"display numbers of processes in following states: running, sleeping, stopped, and defunct (zombie).",query
List all files in the /myfiles directory tree,query
Gets domain name from dig reverse lookup and save in variable go.,query
find all files/directories which have been modified within the last day in the drectories/files taken from the glob pattern /tmp/test/*,query
Recursively change owner and group of /usr/local/rvm/gems/ruby-2.0.0-p481/ to the current user,editor
Unhide all hidden files in the current directory,query
create a symbolic link in current directory named my_db to file /media/public/xampp/mysql/data/my_db,editor
find  files which full path name is /tmpfoo/bar under foo directory and print,query
Lists all running tmux sessions.,query
"Remove trailing white spaces from all files under current directory ignoring .git, .svn directories and binary files",editor
Recursively removes all empty folders under current folder.,query
Recursively removes all files and folders named .svn in a current folder.,query
find all the directories in current folder and do not search in sub directories,query
find all hidden files starting from the directory given as variable $FOLDER,query
Search for Stock in all *.java files from the current directory tree,query
Repeat image.png 10 times on a single line,query
search all mp3 files in the folder /home/you which have been modified yesterday (from the start of day 00:00 to 23:59),query
find all files in maximum 2 levels down the current directory,query
find all empty files in /tmp directory .,query
Delete all files/directories with inode number 117672808 under current directory tree,editor
Get virtual private memory use of process,query
Search for .pdf files,query
find all files in the file system which belong to no user or which have no user,query
display all the files in the current folder excluding the files with the name mmm,query
display a long listing of all the xls or csv files in the entire file system,query
Mathematically sum all numbers in file.txt,query
display all files in the folder home which are owned by the group test.,query
search for the file dok.txt in the kat folder and if it sis present then print the echo statement,query
find and remove the file with inode number 782263 in the current directory tree,editor
find all text files in user/directory/ which have been modified today and display the last line of these files,query
List all regular files residing in the current directory tree and containing string /bin/ksh,query
"find all regular files with permissions 777 under and below /home/user/demo/, and change their permissions to 755",editor
find all files/directories named orm.properties under current directory,query
find all HTML files starting with letter a in the current directory and below ignoring the case,query
Change permission to 755 of all files/directories under current directory tree that have 777 permission,editor
"Copies file /boot/config-`uname -r` to the  .config, printing info message and prompting before owerwriting files.",query
find files modified at least 5 days in the future,query
Replace all matches with the regex expanded by $P_FROM with the text expanded by $P_TO in all regular files under current directory not going into subdirectories and modify the files in-place,editor
create symbolic links in directory /usr/local/symlinks  to all files located in directiry incoming and that have been modified earlier then 5 days and owned by user nr,editor
unzip and search for a word in all the jar files in the current folder and display the matched file name,query
Create symbolic links in the current directory for all files excluding CONFIGFILE located in /your/project,editor
Remove all files with names like vmware-*.log from the current directory tree,editor
"Prints list of folders containing .git, searching recursively from a current folder.",query
display all the directories in the folder /var and do not go beyond 2 levels during search,query
"Store info about all mounted file systems, printing all sizes in powers of 1000",query
find all files/directories in entire file system that are exactly 50 bytes,query
list all files under .performance_test directory except .performance_test/prune_me directory,query
find all the normal/regular files in current directory and display file names with new line as delimiter,query
Print only unique lines of file_name file,query
Save number of lines with any-cased merge from $COMMIT_EDITMSG file in MERGE variable,query
Print the lines of file strings specified in file index,query
find files in the current directory tree whose size is less than 24000 bytes,query
find all JPG files under the $SOURCE directory and below,query
find a specfic video file in the current directory,query
find all the files in the file system which have read permission to the user and display the ten files,editor
Adjust the timestamp of file $filename by subtracting 2 hours from it,editor
search for the file .user.log and display its parent directory,query
Exclude directory from find . command,query
Read a line from standard input with prompt Are you alright? (y/n)  and save the response to variable RESP,query
find all regular files in the home directory tree that were modified in the last 24 hours,query
find all files named new under current directory tree and display their contents,query
find all the mp3 files in the entire file system whose size is bigger than 10MB,query
Search for directory foo ignoring case,query
Remove trailing white spaces and replace CRLF with LF in all files under current directory ignoring .git and .svn directories,editor
Copy all files in the current directory except those containing Music to /target_directory.,editor
Set the verbose shell option causing bash to print shell input lines as they are read,query
find files that were modified more than 7 days ago but less than 14 days ago and archive them,query
find .txt files on the system whose size is greater than 12000 bytes,query
Remove all regular files from the current directory tree whose names do not end with ignore1 or ignore2,editor
find all *.py files/directories under current directory,query
Remove trailing white spaces from all *.py files under dir directory (ignoring .git path) and keep backups of the originals,editor
find all instances of a specific file in the current directory and discard all the errors.,query
Search the /var/www/ tree for files owned by root or unknown group and change their group to apache,editor
Set the shell prompt to host:pwd>,query
ask user confirmation and delete all the files in the directory /mydir which have not been accessed in the last 100*24 hours,editor
"List regular files in current directory with read, write and execute permission for all users and also show the permissions",editor
"Recursively removes all files like *.pyc in a current folder, printing info message about each action.",query
delete all the empty directories in the current folder,editor
list all names of the aliases,query
Search /usr/bin for regular files that were last accessed more than 100 days ago,query
Read a single character from standard input with prompt Are you sure?,query
Search the regular files of the current directory tree for string whatever,query
Remount /home/evgeny with the suid flag set,query
find all directories under current directory and change their permission to 644,editor
search for all the files in current folder which start with file2015-0 and move them to another folder,editor
Replace all instances of ; with \n in bla@some.com;john@home.com,editor
Remove all .sh files in the current directory tree whose names begin with new,editor
find recursively all regular files in the current directory whose names contain .,query
search for the file name_to_find in the home folder,query
find files patching pattern,query
display all the files in the home folder that have been modified in the last 7*24 hours,query
Format file list-of-entries.txt with no column delimiter,query
Search for files/directories with the case insensitive pattern anaconda.* in var/log directory and create an archive (somefile.tar) of all the files found,editor
"Reversibly sorts content of the ${TMP}/${SCRIPT_NAME}.kb file, comparing human readable numbers in file strings.",query
display all soft links in current folder,query
find every file under the directory /usr ending in .stat.,query
Force create a symbolc link named new_dir to /other/dir without dereferencing new_dir,editor
"Recursively finds strings with word-1 or word-2 in any file under directory-path, following symlinks, and prints found strings.",query
Decompress and extract libxml2-sources-2.7.7.tar.gz,editor
"finds all directories named CVS, and deletes them and their contents.",query
Gets IP addresses of all network interfaces.,query
find and remove all .txt regular files under the current directory and below,editor
Finds string beginning with IFS in a set output.,query
Measure the disk space taken up by all *.txt files in the current directory tree,query
List the largest file prefixed by its size in bytes of all files under the current directory,query
Search the current directory tree for files whose names do not end in 1 and 2,query
Delete all empty directories in minimum 1 level down the directory directory,editor
"find all *.xml files under current directory, search for <?xml in those files and print the paths of the matched files.",query
find all broken symlinks in maximum 1 level down the $path directory,query
find all the files/directories in /path/to/files directory tree which have not been modified in the last 2 hours,query
Print only alphanumeric values from /dev/urandom,query
find all the html files in the current folder and search for a pattern in these files,query
find all directories in current directory without going into sub-directories,query
find files in home directory that names are game,query
find all hidden regular files under /tmp and below,query
Counts total lines in all *.php files.,query
Prints logged in users in sorted order.,query
"Print unique lines in sorted file A when compared to sorted files B, C, and D",query
Make directories and parent directories as needed of $1 with \r removed,query
Search the current directory tree for symlinks pointing at other symlinks,query
"Removes folderName, and removes all content within if folderName is folder.",query
Prints long listing of file file.ext.,query
Counts lines of command output.,query
"find all files/directories under current directory that match the case insensitive glob pattern {EA,FS}_*",query
Prints total count of lines of all files in a current folder and subfolders.,query
Print the average round trip time of 5 pings to google.com from OSX,query
Unzip and untar tarball.tar.gz,query
find all the links in the directory students and print them. Do not display any errors.,query
calculate the number of bytes of all the files listed in files.txt,query
split file /usr/bin/firefox into pieces per 1000 lines,query
Stores date of last month day in the lastdaymonth variable.,query
Print local files without descending non-local directories,query
Replace all sequence of blank characters in file log with a single occurence of such symbol and print space-separated fields of each string but first two fields,editor
"Allow all users to execute $pathToShellmyShell.sh""'",query
Pipe output of yes to more and append the first 3 lines to file,editor
List all .c and .h files in the current directory tree that contain thing,query
search for the folder .dummy and remove it from the folder Test folder,editor
Print the base name of the current working directory,query
Prints ten latest modified files within the current directory.,query
Search the current directory tree for files and directories with permissions 775,editor
search for bash and rsync files in the entire file system excluding search in /usr folder and discard all the errors,query
run script /PATH/TO/MY_APP as user USER_FOOBAR in background,query
Search the files under and below /directory/containing/files for pattern_to_search,query
compare each C header file in or below the current directory with the file /tmp/master,query
find all regular files that reside in the current directory tree and were last modified more than 2 days ago,query
Run script `fixname.sh' for each regular file from the current directory tree,query
find all regular files on the system whose names are myfile,query
Fint all *.txt files/directories in entire file system without descending to other file system and without error reporting,query
Recursively copy all files and folders in the current directory excluding exclude_pattern to /to/where/,editor
Change the owner to hduser and group to hadoop of {directory path},editor
Print the IP addresses for the current host name,query
Merge already sorted files *.txt and split the result into files of at most 1000000 lines each with a numeric suffix and a prefix output,query
find all normal/regular files in current folder and display the total lines in them,query
find all the files ending with .ini in the current directory.,query
Print the output of history without line numbers,query
"print all filenames of files under current dir containing foo, case-insensitive",query
find all file which have more the 2 hard link,query
Removes all files from current folder but 5 newest ones.,query
find all *.htm files under current directory and print the changed names by appending 3 levels of parent directory names at the beginning and modifying the actual name to dd-nnn format,query
display all files in the current folder,query
Change permissions to 700 for files and directories deeper than the current directory,editor
Print the directory of the full path to the current script,query
Write every two lines in infile on a single line separated by a space,editor
"Show lss detailed output for all files named something""",query
find all files in the current folder which have been modified in the last 24 hours,query
Change permissions to 755 for all subdirectories of the current directory,editor
Delete all files with indoe number $inum under current directory tree,editor
display all the regular/normal files in the entire file system,query
Reattach a session and if necessary detach or  even  create first,editor
find all *.txt files except for those on other file systems,query
Remove regular files whose names match Perl regular expression \w+-\d+x\d+\.\w+$ from the current directory tree,editor
find all files under /home/username/public_html/modules  and set their permission to 640,editor
Copy all files in the current directory tree matching textToSearch to $destination_path,editor
find recursively the latest modified file in the current directory,query
Look for files with the name search under current directory,query
"find all files/directories with my key phrase in their names under current directory, search for my key phrase in all files under current directory and print a sorted and unique list of output",query
Remove all files under current directory,editor
Look for all files whose names match pattern my*,query
Modify and rewrite file replacing the first instance of foo on each line with bar,editor
set alias restart_rails for command kill -9 `cat tmp/pids/server.pid`; rails server -d,query
Format the time string $timestamp according to the format string %Y-%m-%d %H:%M:%S and save the output to variable CDATE,query
search for the file process.txt in the entire file system,query
Pushes current folder to the directory stack.,query
find files/directories in entire file system that were accessed in less than a day ago,query
Delete all files in the $DIR directory that have not been accessed in 5 or more days.,editor
Rename all thumbs directories to thumb in the current directory and 1 level below,editor
calculate the md5sum of the executable file of command cc,query
search for files with the name temp in the /usr folder,query
"Copy file src to dest, except if dest already exists.",editor
Pair side-by-side content of the file and its side-mirrored content,query
find all regular files with .txt extension excluding README.txt files under current directory tree,query
display the long listing detials of all the files in the folder junk which is in home folder.,query
Create a symbolic link named temp to newtarget,editor
display top 11 files along with the last access date for all the files in the file system,query
"Compresses with compression level 9 all files under the current folder but already compressed *.bz2 files, performing in background.",query
search for the regular/normal files iceweasel or thunderbird in the entire file system and exclude search in the paths /export and directories having the word Recommeded in their name,query
Change to location of $TARGET_FILE file.,editor
find files readable only by the group,query
find all files/directories owned by the user bob under /home directory tree,query
calculate the total size of all *.jpg files in the directory tree,query
display all files in current folder and follow the symbolic links and display the pointed file,query
find all directories containing linux in their names under /root directory tree,query
find disk usage of all files inside the directory,query
find all *.csv files under /foo/bar and move them to some_dir,editor
Replace - with 0 in columns 4 and 5 of file test.in and format as a table,editor
find all of the executable files on your computer,query
Extract any line in f1 or f2 which does not appear in the other,editor
Show files in maximum 1 level down the current directory that were modified less than 1 day ago from today,query
find all regular files in the current directory tree ignoring directory ./source/script,query
Remove trailing white spaces from all files under current directory ignoring directories wtih *.git* (case insensitive) in their paths and keep backups of the originals,editor
find all the regular/normal files ending with .mod in a folder and send them as input to the remodup command,query
find for all *.txt files/directories in vfat file systems,query
ssh into ssh.myhost.net as user myusername and run command mkdir -p $2,editor
"Print chmod commands that can change permissions of regular files residing in the current directory tree to u=rw,g=r,o=",editor
find all files in $dir directory without going into sub-directories,query
create a compressed archive in my_dir directory matching .[^.]* ..?* glob pattern,editor
create a symbolic link with absolute path /cygdrive/c/Program Files to file /cygdrive/c/ProgramFiles,editor
find all empty regular files in the current directory and below,query
List all the file links,query
"Traverse the filesystem just once, listing setuid files and directories into /root/suid.txt and large files into /root/big.txt.",query
Change permissions to 0755 for all directories in the /path directory tree,editor
List characters from standard input showing backslash escapes for non-displayables,query
Stores system load average number in the proc_load_average variable.,query
Print file type of the command c++,query
Print the first word followed by the rest of the line formatted to fit in 100 characters for every line in input,query
get all files in a current directory modified in the last 7 days,query
find all files/directories named top in the entire filesystem,query
"Creates temporary folder in TMPDIR (if defined) or in /tmp/, and stores path to created folder in tmpdir variable.",query
Write list of missing files in Subversion repository to file removedProjs.,editor
find all the files that have been modified exactly 1 day ago,query
display all text files in the current folder,query
find files in the current directory recursively that are not readable by all,query
"Displays calendar of a previous, current and next month for December of 2120 year.",query
