message,label
"find all the normal/regular files in the folder pathfolder which are 2 levels deep, excluding all hidden files and display the count",query
List all file details with filenames matching *2012*.xml from serveripaddress::pt/dir/files/ listening on port 111 and write to output.txt,editor
find all the files in the current folder which have been changed in the last 60 minutes,query
change the permission of all the php files in the folder /var/www/ to 700,editor
find .rm files in the /home/me/download/ directory tree and convert them to the MP3 format,query
Show the number of lines for each .php and .phtml file in the current directory tree,query
"Connect to host hostname as user username, automatically add the host key to the list of known hosts, and execute pwd; ls non-interactively",editor
"Output stuff, removing /foo/bar/ from the specified path.",query
Search the current directory for files whose names start with my,query
Read two bytes from /dev/urandom and print them as an unsigned integer,query
find all files in the current directory and sub-directories that were modified after the /etc/passwd file was modified,query
Print contents of file as space separated hexadecimal bytes on a single line,query
Create a symbolic link relative to link location named $dest_dir/$orig_name to $orig_dest,editor
Search all Python files in the current directory tree for string import antigravity,query
display the contents of  all the regular files in a folder in the sorted order of their depth,query
Move all 10*jpg files under /path to 2010*jpg files under the same directory,editor
"Archive key.pub to directory .ssh in user's home directory on host specified by first parameter to function or script, using ssh to connect on port specified by second parameter to function or script, compress data during transmission.",editor
Prints total count of lines of all *.py files in a current folder and subfolders.,query
SSH into hostname on port 22 as user myName,query
Enables shell option nocaseglob.,query
Recursively changes group ownership of everything within /git/our_repos to shared_group.,query
"Print a minimal set of differences between files in directories a and b, ignore the first 3 lines of output, and print any line starting with - with the first character removed",query
display all the files in the entire file system,query
Remove files matching pattern *-*x*.* from the current directory tree,editor
find files which do not have all permissions to all the users in the current directory,editor
find all directories in level 1 down the $queue directory,query
Recursively copy all .txt files to user@remote.machine:/tmp/newdir/,editor
find all files named `file1' on the system,query
run command set -a; . /path/to/nullmailer-vars; set +a; /usr/sbin/logcheck with a bash as user root,query
Search for hidden files non-recursively,query
display the name of all directories in the current folder and do not search in sub directories ( mindepth ensures that the current folder name is removed from the output),query
Finds file Subscription.java and changes to containing folder.,query
dispaly all the empty regular/normal files in the current folder,query
Search the current directory tree for files and directories whose names do not end in exe and dll,query
Return the list of files named filename that are 50 megabytes or larger,query
Remove trailing white spaces from all files under current directory ignoring .git and .svn directories,editor
Recursively copy all (non-hidden) files and directories in current dir except foo to location specified by variable other,editor
replace a word in all the regular/normal files in the current folder,editor
Write output of command to standard output and append to /path/to/logfile,editor
Finds IP address of en0 network interface.,query
"Lists all subdirectories in a current folder, removing trailing slash.",query
find files named ppp.conf in the /etc directory tree,query
Delete all shared memory and semaphores for the current user on linux,editor
"From a script, output the name of the script itself, without containing directories.",query
Remove all CVS directories from the current directory tree,editor
find files in the current directory tree whose size is 24000 bytes,query
search for the directory mysql in the /etc folder,query
Remove trailing white spaces from all *.rb files under current directory,editor
Sort strings of test.txt file by second from the end field,query
create directory es if it is not exist and create direcoty LC_MESSAGES,editor
find all jpg files in the current folder,query
Merge colon-separated information from file1 and file2 where first field of both files matches,query
Change the owner of all files in /empty_dir/ to root using at most 10 files at a time,editor
Save number of lines in file.txt file in nbLines variable,query
Locate logo.gif in the /var/www directory tree,query
find all files under /home/username/public_html/sites/all/themes and set their permission to 640,editor
Run command program as the current user,query
find all files/directories with inode number 16187430 and move them to new-test-file-name,editor
Print test=hello world,query
find recursively all files changed within the last 5 minutes starting from directory b,query
Move all *.log files under $sourcePath that were modified more than 10 days ago to a zip archive $zipFile with only file names (not full path),editor
Generates a randomly sorted list of numbers from 1 to 10.,query
change group of the file /var/lib/php/session  to group lighttpd,editor
"find all the text files in  the current folder and do not search in somedir, bin directories",query
Forcefully delete all files in the current directory that begin with spam-,editor
Set permissions of all directories under /opt/lampp/htdocs to 755,editor
Archive source to destination via ssh on port PORT_NUMBER,query
Search for all files in the current directory recursively whose names end with Linkin Park,query
find all files with .conf extension under /etc directory tree that have been modified in the last 30 minutes,query
Delete all lines matching some string here in yourfile,editor
"find files containing `blah' in their names modified less than 2 days ago, case insensitive",query
list all the files in the file system excluding proc folder and excluding symbolic links which have write permission for the user,editor
Set environment variables using assignments are listed in .env file and run rails command with defined environment,query
set alias : for command xargs -I{},query
find files and directories in the /tmp/ tree that contain spaces in their names and replace those spaces with underscores,editor
find all the files that have been changed today,query
Replace all occurrence of subdomainA.example.com with subdomainB.example.com in all files under the current directory and below ignoring SVN files,editor
display long list of all the perl files in the current folder,query
find the file fluidpoint in the file system and discard all the errors,query
SSH into server server.com as user remote_user,query
Remove all *.log files from the current directory tree,editor
"calculate the SHA1 sum for the contents of the path/to/folder directory tree, including permissions",editor
display a sorted count of all the characters in filename,query
"Isolate first comma-delimited field of each line in file, discard consecutive duplicates, and search file for first matching occurrence of that field.",query
find all regular files under $d directory tree and change their permissions to 777,editor
Print the output of history without line numbers,query
find all the files that have not been modified in the last (24*7) hours.,query
find files in the current directory tree which have permissions rwx for user and rw for group and others,editor
List all files without descending into subdirectories,query
find all files in the file system which belong to the user pat and having the word filename in their name.,query
Unsets random one from first four array members.,query
Print command line of process with pid 17709,query
Repeat image.png 10 times on a single line,query
Send one ping request to local machine.,query
Search the /usr/bin directory tree for regular files accessed more than 100 days ago,query
Move all hidden files in /path/subfolder/ to /path/,editor
Read a line from standard input with prompt Enter your choice:  and save response to variable choice,query
search for all the non-hidden files in the current directory and do not search in the subfolders and dispaly their name and size.,query
Select everything selected by * without descending into any directories,query
"Make directories ~/foo/bar/baz, ~/foo/bar/bif, and ~/foo/boo/bang as needed",query
Pipe the output of program1 to both program2 and program3,query
find all the text files present in the current directory excluding the search in certain paths.,query
Remove all files last modified more than 10 days ago from the current directory tree,editor
"Finds pattern text ignoring letter case in all .js files, prints matched strings and name of file with that strings.",query
List all files/directories under current directory,query
find files with a question mark in their names and save the output as a file,query
find all the files whose name is FindCommandExamples.txt and contains both capital and small letters in / directory,query
find *log files/directories within a maximum of 3 levels of directories,query
list regular file which file name end with *.c or *.sh in current directory,query
find all files/directores under /etc filter them by searching for test in their name and run the file command on each of them,query
List files larger than 10MB under /var/log /tmp that haven't changed in a month,query
find *.html files in the current directory tree that were modified 7 days ago,query
search for all the directories in the current folder and run the print command in the searched folder,query
Search the current directory tree for .VER files,query
"show a count of the number of filenames ending in .txt in the current directory, without descending into sub-directories",query
find all the files starting with config in the folder Symfony ( case insensitive search),query
find all files under current directory and replace the match of the regex ^.*/S with S in every line of the output,editor
find all files with name ending with .txt and display only the filenames without full paths,query
find all read only files in  /home directory,query
search for a string in gzip'd files,query
Returns unsuccessful exit code on each found file like *tests* within current directory.,query
Forcibly removes ${temp} file.,query
print all readline bindings,query
Wrap each line in yourfile to fit in 79 characters and right pad any lines shorter with spaces,query
"set alias memu for command ps -u $(whoami) -o pid,rss,command | awk {print \$0}{sum+=\$2} END {print \Total\, sum/1024, \MB\}'""",query
Search for the string magic in all regular files under current directory tree and display long listing of them,query
change owner and group of the file it to user and group root,editor
"Get the processors addressing bus width from the output of lshw, ie. 64 bits"".",query
display the named characters in line1\r\nline2,query
find all files/directories in directories/files taken from the glob pattern /tmp/test/* that were modified within the last day (day counted from today),query
List (in long list format with inode number) the file under the current directory that has the oldest modification time,query
find all the SUID files in the current directory tree,query
Print a list of all duplicate case insensitive file paths in the current directory tree,query
find all files that have the SUID bit set,query
List all files and sub directories including hidden files in the current directory tree,query
Assign the alias rm2g to a find command that removes any .tar file larger than 2 gigabytes.,query
"find foo, Foo, FOo, FOO, etc., but only files",query
find all *.dbf files/directories in entire file system discarding errors and print their sorted and unique parent directory paths,query
Force create a hard link in /usr/local/bin to findpdftext,editor
Copies src to dest preserving overwriting the existing files.,query
Count all the lines of code in all php files in current directory recursively,query
"Send one ping request to host with local address in the 10.0.0.x range, with last number specified by variable i, waiting 1 second for a reply, and output only lines containing from to standard output.",query
Insert | every 30 characters in file longline,editor
find all the pdf files in a folder which start with a specific name and display them in the sorted order of their time stamps,query
display all the files in the home folder which begin with arrow,query
search for the file test.txt in the folders /home and /opt,query
SSH into user@server and run command ${SSH_COMMAND},query
Do a dry run of renaming file extension .andnav to .tile for all files/directories under current directory tree,query
Archive directory symdir to symdir_output preserving symbolic links.,query
Split file afile into parts as of two lines per each and compress each part with bzip2,editor
Gets IP address of en1 network interface.,query
"Rename file.txt in directories v_1, v_2, and v_3 each to v_1.txt, v_2.txt, and v_3.txt respectively and print the conversion",editor
Replaces any occurences of *favicon.ico* in any subfolder with file /root/favicon.ico.,query
Recursively lists all *.py and *.html files in a current folder.,query
Move all *.pdf.marker files and their corresponding *.pdf files under ${INPUT_LOCATION} to ${OUTPUT_LOCATION},editor
find all files under current directory,query
Copy current working directory to clipboard,editor
find files/directories modified within the last day under /etc,query
Replace sequential tabs with a single space in thefile.txt and write to the_modified_copy.txt,editor
Export variable PS1 as the current username @ the hostname,query
Create a compressed archive named my_directory.tar.gz with files inside directory my_directory without including the directory entry my_directory itself,editor
Print the list of files and directories of the current directory,query
Save IP addresses of the host name in variable ip,query
"Creates full path with parents, that matches to folder path extracted from $f variable.",query
Take a file path from standard input and remove it.,editor
display all the directories in the current folder which are atleast one level deep,query
find all the files in the entire file system which have been modified in the last 5 days,query
Copy the executable python2.7 in $PATH to myenv/bin/python,editor
find all build* directories under /var/www/html/ and reverse sort them,query
find all Read Only files,query
Show all files that have not been accessed in the $HOME directory for 30 days or more,query
Delete all hidden files under $some_directory,editor
"find files that are writable by the user, the group, or both",query
find & calculate total number of worlds in all .txt file from current directory,query
Set the exit code($?) to 0.,query
sort and display top 11 files along with the last access date for all the files in the file system ( sort based on the timestamp ),query
